{
  "$schema": "../schemas/storage-catalog.schema.json",
  "apiVersion": "northgate/v1alpha1",
  "kind": "StorageCatalog",
  "catalogVersion": "2026.08.30.1",
  "profiles": [
    {
      "id": "lab-ephemeral-d",
      "serverPolicyId": "ng-storage-lab-ephemeral-d-v1",
      "approvalStatus": "approved",
      "allowProvision": true,
      "criticalWorkloadsAllowed": false
    },
    {
      "id": "lab-ephemeral-f",
      "serverPolicyId": "ng-storage-lab-ephemeral-f-v1",
      "approvalStatus": "approved",
      "allowProvision": true,
      "criticalWorkloadsAllowed": false
    },
    {
      "id": "persistent-tooling",
      "serverPolicyId": "ng-storage-persistent-tooling-v1",
      "approvalStatus": "approved",
      "allowProvision": true,
      "criticalWorkloadsAllowed": false
    },
    {
      "id": "persistent-app-protected",
      "serverPolicyId": "ng-storage-persistent-app-protected-v1",
      "approvalStatus": "approved",
      "allowProvision": true,
      "criticalWorkloadsAllowed": true
    },
    {
      "id": "persistent-workstations",
      "serverPolicyId": "ng-storage-persistent-workstations-v1",
      "approvalStatus": "approved",
      "allowProvision": true,
      "criticalWorkloadsAllowed": true
    },
    {
      "id": "persistent-mail-protected",
      "serverPolicyId": "ng-storage-persistent-mail-protected-v1",
      "approvalStatus": "approved",
      "allowProvision": true,
      "criticalWorkloadsAllowed": true
    },
    {
      "id": "persistent-rmm-protected",
      "serverPolicyId": "ng-storage-persistent-rmm-protected-v1",
      "approvalStatus": "proposed",
      "allowProvision": false,
      "criticalWorkloadsAllowed": false,
      "allowDataDisks": true,
      "maximumDataDiskCount": 1,
      "maximumDataDiskGiB": 100,
      "maximumTotalDataDiskGiB": 100
    }
  ]
}
